{
  "schema_version": "1.0",
  "gate_id": "PB-03-STAGE-A",
  "commit_sha": "0836b5fdf3088a85d3031d83085779ce47fb8097",
  "image_fingerprint": "sha256:ff0e3e6c111adee352cb085ebb3df49aebe3f10615651a2118eb8038da3c7cce (api=sha256:d04d4a65c8789f954b4ded920b3d104a7e36b63957c3d5cfed260b6385ba0c0a;authority=sha256:56890153c1761450cd4f0ae9c4352864f3597102546f73f9afb09a1d5e8a45d4)",
  "environment_kind": "disposable-docker",
  "executed_at_utc": "2026-10-18T23:02:37Z",
  "results": [
    {
      "test_id": "SEC-P01",
      "outcome": "PASS",
      "evidence_path": "evidence/SEC-P01.json",
      "evidence_sha256": "852b5a528aa41a5aecb7d2f228c525f1ee9859b0c5df8264c66c13d0f8d9929c",
      "commit_sha": "0836b5fdf3088a85d3031d83085779ce47fb8097",
      "image_fingerprint": "sha256:ff0e3e6c111adee352cb085ebb3df49aebe3f10615651a2118eb8038da3c7cce (api=sha256:d04d4a65c8789f954b4ded920b3d104a7e36b63957c3d5cfed260b6385ba0c0a;authority=sha256:56890153c1761450cd4f0ae9c4352864f3597102546f73f9afb09a1d5e8a45d4)",
      "executed_at_utc": "2026-10-18T23:02:35Z",
      "authority_revision": 3,
      "content_revision": 1
    },
    {
      "test_id": "SEC-P02",
      "outcome": "PASS",
      "evidence_path": "evidence/SEC-P02.json",
      "evidence_sha256": "1d6e2d739a920e87f64f288c539c6810bd876bb8115b711e7288f4451f57054a",
      "commit_sha": "0836b5fdf3088a85d3031d83085779ce47fb8097",
      "image_fingerprint": "sha256:ff0e3e6c111adee352cb085ebb3df49aebe3f10615651a2118eb8038da3c7cce (api=sha256:d04d4a65c8789f954b4ded920b3d104a7e36b63957c3d5cfed260b6385ba0c0a;authority=sha256:56890153c1761450cd4f0ae9c4352864f3597102546f73f9afb09a1d5e8a45d4)",
      "executed_at_utc": "2026-10-18T23:02:37Z",
      "authority_revision": 4,
      "content_revision": 1
    },
    {
      "test_id": "SEC-P03",
      "outcome": "PASS",
      "evidence_path": "evidence/SEC-P03.json",
      "evidence_sha256": "a1bd9a67d150e0d821474e18992ced734df28f2f065b846a6419a9d4b1549ba1",
      "commit_sha": "0836b5fdf3088a85d3031d83085779ce47fb8097",
      "image_fingerprint": "sha256:ff0e3e6c111adee352cb085ebb3df49aebe3f10615651a2118eb8038da3c7cce (api=sha256:d04d4a65c8789f954b4ded920b3d104a7e36b63957c3d5cfed260b6385ba0c0a;authority=sha256:56890153c1761450cd4f0ae9c4352864f3597102546f73f9afb09a1d5e8a45d4)",
      "executed_at_utc": "2026-10-18T23:02:30Z",
      "authority_revision": 7,
      "content_revision": 1
    },
    {
      "test_id": "SEC-P04",
      "outcome": "PASS",
      "evidence_path": "evidence/SEC-P04.json",
      "evidence_sha256": "f441a88ba07bfc74cb2346ffaaaa2a5501fe99aa5684055ccecfa64408b779b4",
      "commit_sha": "0836b5fdf3088a85d3031d83085779ce47fb8097",
      "image_fingerprint": "sha256:ff0e3e6c111adee352cb085ebb3df49aebe3f10615651a2118eb8038da3c7cce (api=sha256:d04d4a65c8789f954b4ded920b3d104a7e36b63957c3d5cfed260b6385ba0c0a;authority=sha256:56890153c1761450cd4f0ae9c4352864f3597102546f73f9afb09a1d5e8a45d4)",
      "executed_at_utc": "2026-10-18T23:01:27Z",
      "authority_revision": 3,
      "content_revision": 1
    },
    {
      "test_id": "SEC-P05",
      "outcome": "PASS",
      "evidence_path": "evidence/SEC-P05.json",
      "evidence_sha256": "5ea592e2708503500c33431adb48ca4c5cab5cbbe3a68b642a8d6041bf6b8d3b",
      "commit_sha": "0836b5fdf3088a85d3031d83085779ce47fb8097",
      "image_fingerprint": "sha256:ff0e3e6c111adee352cb085ebb3df49aebe3f10615651a2118eb8038da3c7cce (api=sha256:d04d4a65c8789f954b4ded920b3d104a7e36b63957c3d5cfed260b6385ba0c0a;authority=sha256:56890153c1761450cd4f0ae9c4352864f3597102546f73f9afb09a1d5e8a45d4)",
      "executed_at_utc": "2026-10-18T23:01:23Z",
      "authority_revision": 3,
      "content_revision": 1
    },
    {
      "test_id": "SEC-P06",
      "outcome": "PASS",
      "evidence_path": "evidence/SEC-P06.json",
      "evidence_sha256": "515eac378803612aa40431e05c1754b8f43faab0725b51fb7666d30669f099b9",
      "commit_sha": "0836b5fdf3088a85d3031d83085779ce47fb8097",
      "image_fingerprint": "sha256:ff0e3e6c111adee352cb085ebb3df49aebe3f10615651a2118eb8038da3c7cce (api=sha256:d04d4a65c8789f954b4ded920b3d104a7e36b63957c3d5cfed260b6385ba0c0a;authority=sha256:56890153c1761450cd4f0ae9c4352864f3597102546f73f9afb09a1d5e8a45d4)",
      "executed_at_utc": "2026-10-18T23:02:33Z",
      "authority_revision": 5,
      "content_revision": 1
    },
    {
      "test_id": "SEC-P07",
      "outcome": "PASS",
      "evidence_path": "evidence/SEC-P07.json",
      "evidence_sha256": "bf31c9acfb0efe3d2fdc37f00fb5d0a9c61e20f13afbbe58b41280522e027e09",
      "commit_sha": "0836b5fdf3088a85d3031d83085779ce47fb8097",
      "image_fingerprint": "sha256:ff0e3e6c111adee352cb085ebb3df49aebe3f10615651a2118eb8038da3c7cce (api=sha256:d04d4a65c8789f954b4ded920b3d104a7e36b63957c3d5cfed260b6385ba0c0a;authority=sha256:56890153c1761450cd4f0ae9c4352864f3597102546f73f9afb09a1d5e8a45d4)",
      "executed_at_utc": "2026-10-18T23:02:27Z",
      "authority_revision": 4,
      "content_revision": 1
    },
    {
      "test_id": "SEC-P08",
      "outcome": "PASS",
      "evidence_path": "evidence/SEC-P08.json",
      "evidence_sha256": "2e07958159b3d57e94ed3920b8d0169b5e0879c42145078e01e7330b54c3dd2f",
      "commit_sha": "0836b5fdf3088a85d3031d83085779ce47fb8097",
      "image_fingerprint": "sha256:ff0e3e6c111adee352cb085ebb3df49aebe3f10615651a2118eb8038da3c7cce (api=sha256:d04d4a65c8789f954b4ded920b3d104a7e36b63957c3d5cfed260b6385ba0c0a;authority=sha256:56890153c1761450cd4f0ae9c4352864f3597102546f73f9afb09a1d5e8a45d4)",
      "executed_at_utc": "2026-10-18T23:02:08Z",
      "authority_revision": 4,
      "content_revision": 1
    },
    {
      "test_id": "SEC-P09",
      "outcome": "PASS",
      "evidence_path": "evidence/SEC-P09.json",
      "evidence_sha256": "607bfafedc53d37511c8e900f61bdb7c6009258b5cbfd6b7acd30e50533e7db0",
      "commit_sha": "0836b5fdf3088a85d3031d83085779ce47fb8097",
      "image_fingerprint": "sha256:ff0e3e6c111adee352cb085ebb3df49aebe3f10615651a2118eb8038da3c7cce (api=sha256:d04d4a65c8789f954b4ded920b3d104a7e36b63957c3d5cfed260b6385ba0c0a;authority=sha256:56890153c1761450cd4f0ae9c4352864f3597102546f73f9afb09a1d5e8a45d4)",
      "executed_at_utc": "2026-10-18T23:02:19Z",
      "authority_revision": 5,
      "content_revision": 1
    },
    {
      "test_id": "SEC-P10",
      "outcome": "PASS",
      "evidence_path": "evidence/SEC-P10.json",
      "evidence_sha256": "359a32c87210b5aa7a7f97ec4744a4fb94da19088c83fc7a49a7c8176cc984e1",
      "commit_sha": "0836b5fdf3088a85d3031d83085779ce47fb8097",
      "image_fingerprint": "sha256:ff0e3e6c111adee352cb085ebb3df49aebe3f10615651a2118eb8038da3c7cce (api=sha256:d04d4a65c8789f954b4ded920b3d104a7e36b63957c3d5cfed260b6385ba0c0a;authority=sha256:56890153c1761450cd4f0ae9c4352864f3597102546f73f9afb09a1d5e8a45d4)",
      "executed_at_utc": "2026-10-18T23:01:31Z",
      "authority_revision": 5,
      "content_revision": 2
    },
    {
      "test_id": "SEC-P11",
      "outcome": "PASS",
      "evidence_path": "evidence/SEC-P11.json",
      "evidence_sha256": "d6123382dfb7e1941f3c51b3939b59c3b67ea12bfe36893ec18d0a551b7b50d9",
      "commit_sha": "0836b5fdf3088a85d3031d83085779ce47fb8097",
      "image_fingerprint": "sha256:ff0e3e6c111adee352cb085ebb3df49aebe3f10615651a2118eb8038da3c7cce (api=sha256:d04d4a65c8789f954b4ded920b3d104a7e36b63957c3d5cfed260b6385ba0c0a;authority=sha256:56890153c1761450cd4f0ae9c4352864f3597102546f73f9afb09a1d5e8a45d4)",
      "executed_at_utc": "2026-10-18T23:01:17Z",
      "authority_revision": 3,
      "content_revision": 1
    },
    {
      "test_id": "SEC-P12",
      "outcome": "PASS",
      "evidence_path": "evidence/SEC-P12.json",
      "evidence_sha256": "f52fe65fc2e78f900a8437029c46618770fb8aedb29cecf42bc903632d06eece",
      "commit_sha": "0836b5fdf3088a85d3031d83085779ce47fb8097",
      "image_fingerprint": "sha256:ff0e3e6c111adee352cb085ebb3df49aebe3f10615651a2118eb8038da3c7cce (api=sha256:d04d4a65c8789f954b4ded920b3d104a7e36b63957c3d5cfed260b6385ba0c0a;authority=sha256:56890153c1761450cd4f0ae9c4352864f3597102546f73f9afb09a1d5e8a45d4)",
      "executed_at_utc": "2026-10-18T23:01:50Z",
      "authority_revision": 4,
      "content_revision": 2
    }
  ]
}