{
  "schema_version": "1.0",
  "gate_id": "PB-03-STAGE-A",
  "commit_sha": "2f792900ac775f1238c867c7e41819f39209472b",
  "image_fingerprint": "sha256:8c7151b43ce67d53cdf7ad0b1ef94e5dc2ff2cab9acf2377779b7dd43894c7f8 (api=sha256:62e90533ce34cdc26751ecc84795c2b6536983d4a630d000351defdbe166196a;authority=sha256:5553b34eb6ff000c66ae0df990a98fc6c88b326e4f0398d53faa2f8418cbf14b)",
  "environment_kind": "disposable-docker",
  "executed_at_utc": "2026-10-19T13:19:05Z",
  "results": [
    {
      "test_id": "SEC-P01",
      "outcome": "PASS",
      "evidence_path": "evidence/SEC-P01.json",
      "evidence_sha256": "655396ac9792f6ce5c3d5b34c96c306e2c852c399aeaa750b34208a0c91f146a",
      "commit_sha": "2f792900ac775f1238c867c7e41819f39209472b",
      "image_fingerprint": "sha256:8c7151b43ce67d53cdf7ad0b1ef94e5dc2ff2cab9acf2377779b7dd43894c7f8 (api=sha256:62e90533ce34cdc26751ecc84795c2b6536983d4a630d000351defdbe166196a;authority=sha256:5553b34eb6ff000c66ae0df990a98fc6c88b326e4f0398d53faa2f8418cbf14b)",
      "executed_at_utc": "2026-10-19T13:19:03Z",
      "authority_revision": 3,
      "content_revision": 1
    },
    {
      "test_id": "SEC-P02",
      "outcome": "PASS",
      "evidence_path": "evidence/SEC-P02.json",
      "evidence_sha256": "32a2ce77380eccd3e53e560fe1986a848608e0d75a1a14dbf8575a74f16b698f",
      "commit_sha": "2f792900ac775f1238c867c7e41819f39209472b",
      "image_fingerprint": "sha256:8c7151b43ce67d53cdf7ad0b1ef94e5dc2ff2cab9acf2377779b7dd43894c7f8 (api=sha256:62e90533ce34cdc26751ecc84795c2b6536983d4a630d000351defdbe166196a;authority=sha256:5553b34eb6ff000c66ae0df990a98fc6c88b326e4f0398d53faa2f8418cbf14b)",
      "executed_at_utc": "2026-10-19T13:19:05Z",
      "authority_revision": 4,
      "content_revision": 1
    },
    {
      "test_id": "SEC-P03",
      "outcome": "PASS",
      "evidence_path": "evidence/SEC-P03.json",
      "evidence_sha256": "ec715bc6d3733f86493ceee6d275796b8c534f7ff18cb9f5baae9943b82c41f5",
      "commit_sha": "2f792900ac775f1238c867c7e41819f39209472b",
      "image_fingerprint": "sha256:8c7151b43ce67d53cdf7ad0b1ef94e5dc2ff2cab9acf2377779b7dd43894c7f8 (api=sha256:62e90533ce34cdc26751ecc84795c2b6536983d4a630d000351defdbe166196a;authority=sha256:5553b34eb6ff000c66ae0df990a98fc6c88b326e4f0398d53faa2f8418cbf14b)",
      "executed_at_utc": "2026-10-19T13:18:59Z",
      "authority_revision": 7,
      "content_revision": 1
    },
    {
      "test_id": "SEC-P04",
      "outcome": "PASS",
      "evidence_path": "evidence/SEC-P04.json",
      "evidence_sha256": "a7adfc98aa719273a58c7a1bffe5aef95f2ce2f027086e8f0f6e584e1682b755",
      "commit_sha": "2f792900ac775f1238c867c7e41819f39209472b",
      "image_fingerprint": "sha256:8c7151b43ce67d53cdf7ad0b1ef94e5dc2ff2cab9acf2377779b7dd43894c7f8 (api=sha256:62e90533ce34cdc26751ecc84795c2b6536983d4a630d000351defdbe166196a;authority=sha256:5553b34eb6ff000c66ae0df990a98fc6c88b326e4f0398d53faa2f8418cbf14b)",
      "executed_at_utc": "2026-10-19T13:17:57Z",
      "authority_revision": 3,
      "content_revision": 1
    },
    {
      "test_id": "SEC-P05",
      "outcome": "PASS",
      "evidence_path": "evidence/SEC-P05.json",
      "evidence_sha256": "a4ab33a9ee8e2fe9e191e81f2788520f613ae7588f1a34a289ea91da18bf3eb0",
      "commit_sha": "2f792900ac775f1238c867c7e41819f39209472b",
      "image_fingerprint": "sha256:8c7151b43ce67d53cdf7ad0b1ef94e5dc2ff2cab9acf2377779b7dd43894c7f8 (api=sha256:62e90533ce34cdc26751ecc84795c2b6536983d4a630d000351defdbe166196a;authority=sha256:5553b34eb6ff000c66ae0df990a98fc6c88b326e4f0398d53faa2f8418cbf14b)",
      "executed_at_utc": "2026-10-19T13:17:54Z",
      "authority_revision": 3,
      "content_revision": 1
    },
    {
      "test_id": "SEC-P06",
      "outcome": "PASS",
      "evidence_path": "evidence/SEC-P06.json",
      "evidence_sha256": "de46e164a63450e2cb15f5ad2c3c5f2938d0083202b962ded5f1bea9e614b01b",
      "commit_sha": "2f792900ac775f1238c867c7e41819f39209472b",
      "image_fingerprint": "sha256:8c7151b43ce67d53cdf7ad0b1ef94e5dc2ff2cab9acf2377779b7dd43894c7f8 (api=sha256:62e90533ce34cdc26751ecc84795c2b6536983d4a630d000351defdbe166196a;authority=sha256:5553b34eb6ff000c66ae0df990a98fc6c88b326e4f0398d53faa2f8418cbf14b)",
      "executed_at_utc": "2026-10-19T13:19:01Z",
      "authority_revision": 5,
      "content_revision": 1
    },
    {
      "test_id": "SEC-P07",
      "outcome": "PASS",
      "evidence_path": "evidence/SEC-P07.json",
      "evidence_sha256": "715f05f8efd48c74c96c710e9535ffa53c0df9fa853af59036ccbcd37cd3912b",
      "commit_sha": "2f792900ac775f1238c867c7e41819f39209472b",
      "image_fingerprint": "sha256:8c7151b43ce67d53cdf7ad0b1ef94e5dc2ff2cab9acf2377779b7dd43894c7f8 (api=sha256:62e90533ce34cdc26751ecc84795c2b6536983d4a630d000351defdbe166196a;authority=sha256:5553b34eb6ff000c66ae0df990a98fc6c88b326e4f0398d53faa2f8418cbf14b)",
      "executed_at_utc": "2026-10-19T13:18:56Z",
      "authority_revision": 4,
      "content_revision": 1
    },
    {
      "test_id": "SEC-P08",
      "outcome": "PASS",
      "evidence_path": "evidence/SEC-P08.json",
      "evidence_sha256": "4d75a14e34c127eb388722aef8e06d50f0d73795a7db1e0a13cf45f48a5a7e44",
      "commit_sha": "2f792900ac775f1238c867c7e41819f39209472b",
      "image_fingerprint": "sha256:8c7151b43ce67d53cdf7ad0b1ef94e5dc2ff2cab9acf2377779b7dd43894c7f8 (api=sha256:62e90533ce34cdc26751ecc84795c2b6536983d4a630d000351defdbe166196a;authority=sha256:5553b34eb6ff000c66ae0df990a98fc6c88b326e4f0398d53faa2f8418cbf14b)",
      "executed_at_utc": "2026-10-19T13:18:37Z",
      "authority_revision": 4,
      "content_revision": 1
    },
    {
      "test_id": "SEC-P09",
      "outcome": "PASS",
      "evidence_path": "evidence/SEC-P09.json",
      "evidence_sha256": "4970ee34771d88a529072e3b8ec762cd0102a063e6d2d487d723029996b4d3c0",
      "commit_sha": "2f792900ac775f1238c867c7e41819f39209472b",
      "image_fingerprint": "sha256:8c7151b43ce67d53cdf7ad0b1ef94e5dc2ff2cab9acf2377779b7dd43894c7f8 (api=sha256:62e90533ce34cdc26751ecc84795c2b6536983d4a630d000351defdbe166196a;authority=sha256:5553b34eb6ff000c66ae0df990a98fc6c88b326e4f0398d53faa2f8418cbf14b)",
      "executed_at_utc": "2026-10-19T13:18:47Z",
      "authority_revision": 5,
      "content_revision": 1
    },
    {
      "test_id": "SEC-P10",
      "outcome": "PASS",
      "evidence_path": "evidence/SEC-P10.json",
      "evidence_sha256": "5c7e885a5602060cf81c7b2fecaf22346eb219efe75b152750a4b1fb793141a3",
      "commit_sha": "2f792900ac775f1238c867c7e41819f39209472b",
      "image_fingerprint": "sha256:8c7151b43ce67d53cdf7ad0b1ef94e5dc2ff2cab9acf2377779b7dd43894c7f8 (api=sha256:62e90533ce34cdc26751ecc84795c2b6536983d4a630d000351defdbe166196a;authority=sha256:5553b34eb6ff000c66ae0df990a98fc6c88b326e4f0398d53faa2f8418cbf14b)",
      "executed_at_utc": "2026-10-19T13:18:01Z",
      "authority_revision": 5,
      "content_revision": 2
    },
    {
      "test_id": "SEC-P11",
      "outcome": "PASS",
      "evidence_path": "evidence/SEC-P11.json",
      "evidence_sha256": "dce2042ab96ee1b01e2d7ae25f8588a6b576a6703cfdf7ba3d3bf20017306f59",
      "commit_sha": "2f792900ac775f1238c867c7e41819f39209472b",
      "image_fingerprint": "sha256:8c7151b43ce67d53cdf7ad0b1ef94e5dc2ff2cab9acf2377779b7dd43894c7f8 (api=sha256:62e90533ce34cdc26751ecc84795c2b6536983d4a630d000351defdbe166196a;authority=sha256:5553b34eb6ff000c66ae0df990a98fc6c88b326e4f0398d53faa2f8418cbf14b)",
      "executed_at_utc": "2026-10-19T13:17:48Z",
      "authority_revision": 3,
      "content_revision": 1
    },
    {
      "test_id": "SEC-P12",
      "outcome": "PASS",
      "evidence_path": "evidence/SEC-P12.json",
      "evidence_sha256": "1a5cb0cb792d99e072a2b56c0055c04abaf6075b6d54cb515ab75e72860b6200",
      "commit_sha": "2f792900ac775f1238c867c7e41819f39209472b",
      "image_fingerprint": "sha256:8c7151b43ce67d53cdf7ad0b1ef94e5dc2ff2cab9acf2377779b7dd43894c7f8 (api=sha256:62e90533ce34cdc26751ecc84795c2b6536983d4a630d000351defdbe166196a;authority=sha256:5553b34eb6ff000c66ae0df990a98fc6c88b326e4f0398d53faa2f8418cbf14b)",
      "executed_at_utc": "2026-10-19T13:18:19Z",
      "authority_revision": 4,
      "content_revision": 2
    }
  ]
}