{
  "schema_version": "1.0",
  "gate_id": "PB-03-STAGE-A",
  "commit_sha": "fdc7a5e83c67654e5f72976600873e0f825f172f",
  "image_fingerprint": "sha256:da93c3cea15ac9a19345e82da1fa03eb7089c1de4cd7c7e62d3d70d8cf3e9168 (api=sha256:7289f6d9dc7496c97578bd512ddc72b318c994743c902bea3c5876e978529af4;authority=sha256:7a860ac7d6f9dd4c54c137a94d18eb26e57287c8e09524cbeafb54c50841c360)",
  "environment_kind": "disposable-docker",
  "executed_at_utc": "2026-10-19T18:17:38Z",
  "results": [
    {
      "test_id": "SEC-P01",
      "outcome": "PASS",
      "evidence_path": "evidence/SEC-P01.json",
      "evidence_sha256": "34013dba7304b1f56d207747777392b90ecc0a22359b2fd0f96bc3439f75bcfc",
      "commit_sha": "fdc7a5e83c67654e5f72976600873e0f825f172f",
      "image_fingerprint": "sha256:da93c3cea15ac9a19345e82da1fa03eb7089c1de4cd7c7e62d3d70d8cf3e9168 (api=sha256:7289f6d9dc7496c97578bd512ddc72b318c994743c902bea3c5876e978529af4;authority=sha256:7a860ac7d6f9dd4c54c137a94d18eb26e57287c8e09524cbeafb54c50841c360)",
      "executed_at_utc": "2026-10-19T18:17:35Z",
      "authority_revision": 3,
      "content_revision": 1
    },
    {
      "test_id": "SEC-P02",
      "outcome": "PASS",
      "evidence_path": "evidence/SEC-P02.json",
      "evidence_sha256": "fd21c00ce08e7983a3e1f0c68bb4a7d52ccb5f1c1e3509afff6be2276e3b7035",
      "commit_sha": "fdc7a5e83c67654e5f72976600873e0f825f172f",
      "image_fingerprint": "sha256:da93c3cea15ac9a19345e82da1fa03eb7089c1de4cd7c7e62d3d70d8cf3e9168 (api=sha256:7289f6d9dc7496c97578bd512ddc72b318c994743c902bea3c5876e978529af4;authority=sha256:7a860ac7d6f9dd4c54c137a94d18eb26e57287c8e09524cbeafb54c50841c360)",
      "executed_at_utc": "2026-10-19T18:17:38Z",
      "authority_revision": 4,
      "content_revision": 1
    },
    {
      "test_id": "SEC-P03",
      "outcome": "PASS",
      "evidence_path": "evidence/SEC-P03.json",
      "evidence_sha256": "c53f966add57e1fc9106ff3d9766d1660aaeffe03ae0f41168984bbc4351f25a",
      "commit_sha": "fdc7a5e83c67654e5f72976600873e0f825f172f",
      "image_fingerprint": "sha256:da93c3cea15ac9a19345e82da1fa03eb7089c1de4cd7c7e62d3d70d8cf3e9168 (api=sha256:7289f6d9dc7496c97578bd512ddc72b318c994743c902bea3c5876e978529af4;authority=sha256:7a860ac7d6f9dd4c54c137a94d18eb26e57287c8e09524cbeafb54c50841c360)",
      "executed_at_utc": "2026-10-19T18:17:31Z",
      "authority_revision": 7,
      "content_revision": 1
    },
    {
      "test_id": "SEC-P04",
      "outcome": "PASS",
      "evidence_path": "evidence/SEC-P04.json",
      "evidence_sha256": "2e5d49cd9ef373cf053b279cbc86a325d0c1beb30f6b474e42d88fd94dae32bd",
      "commit_sha": "fdc7a5e83c67654e5f72976600873e0f825f172f",
      "image_fingerprint": "sha256:da93c3cea15ac9a19345e82da1fa03eb7089c1de4cd7c7e62d3d70d8cf3e9168 (api=sha256:7289f6d9dc7496c97578bd512ddc72b318c994743c902bea3c5876e978529af4;authority=sha256:7a860ac7d6f9dd4c54c137a94d18eb26e57287c8e09524cbeafb54c50841c360)",
      "executed_at_utc": "2026-10-19T18:16:21Z",
      "authority_revision": 3,
      "content_revision": 1
    },
    {
      "test_id": "SEC-P05",
      "outcome": "PASS",
      "evidence_path": "evidence/SEC-P05.json",
      "evidence_sha256": "f3b20fc96769f2877da32b28ea09b20e8f65caec1f7956f790382ceffe8f00b0",
      "commit_sha": "fdc7a5e83c67654e5f72976600873e0f825f172f",
      "image_fingerprint": "sha256:da93c3cea15ac9a19345e82da1fa03eb7089c1de4cd7c7e62d3d70d8cf3e9168 (api=sha256:7289f6d9dc7496c97578bd512ddc72b318c994743c902bea3c5876e978529af4;authority=sha256:7a860ac7d6f9dd4c54c137a94d18eb26e57287c8e09524cbeafb54c50841c360)",
      "executed_at_utc": "2026-10-19T18:16:17Z",
      "authority_revision": 3,
      "content_revision": 1
    },
    {
      "test_id": "SEC-P06",
      "outcome": "PASS",
      "evidence_path": "evidence/SEC-P06.json",
      "evidence_sha256": "7ef910a9fa4e399a3f0e92ce0b164e920592f2247a771a4dc9a8f8fd04c1b868",
      "commit_sha": "fdc7a5e83c67654e5f72976600873e0f825f172f",
      "image_fingerprint": "sha256:da93c3cea15ac9a19345e82da1fa03eb7089c1de4cd7c7e62d3d70d8cf3e9168 (api=sha256:7289f6d9dc7496c97578bd512ddc72b318c994743c902bea3c5876e978529af4;authority=sha256:7a860ac7d6f9dd4c54c137a94d18eb26e57287c8e09524cbeafb54c50841c360)",
      "executed_at_utc": "2026-10-19T18:17:33Z",
      "authority_revision": 5,
      "content_revision": 1
    },
    {
      "test_id": "SEC-P07",
      "outcome": "PASS",
      "evidence_path": "evidence/SEC-P07.json",
      "evidence_sha256": "365036409dd0436fef8315fc15e4c4f97359401d38d737ef2c856a8a6beaae8a",
      "commit_sha": "fdc7a5e83c67654e5f72976600873e0f825f172f",
      "image_fingerprint": "sha256:da93c3cea15ac9a19345e82da1fa03eb7089c1de4cd7c7e62d3d70d8cf3e9168 (api=sha256:7289f6d9dc7496c97578bd512ddc72b318c994743c902bea3c5876e978529af4;authority=sha256:7a860ac7d6f9dd4c54c137a94d18eb26e57287c8e09524cbeafb54c50841c360)",
      "executed_at_utc": "2026-10-19T18:17:27Z",
      "authority_revision": 4,
      "content_revision": 1
    },
    {
      "test_id": "SEC-P08",
      "outcome": "PASS",
      "evidence_path": "evidence/SEC-P08.json",
      "evidence_sha256": "5007794965aacf42b35710b518579436a273addb5de6862ee93cf380a9c632b0",
      "commit_sha": "fdc7a5e83c67654e5f72976600873e0f825f172f",
      "image_fingerprint": "sha256:da93c3cea15ac9a19345e82da1fa03eb7089c1de4cd7c7e62d3d70d8cf3e9168 (api=sha256:7289f6d9dc7496c97578bd512ddc72b318c994743c902bea3c5876e978529af4;authority=sha256:7a860ac7d6f9dd4c54c137a94d18eb26e57287c8e09524cbeafb54c50841c360)",
      "executed_at_utc": "2026-10-19T18:17:04Z",
      "authority_revision": 4,
      "content_revision": 1
    },
    {
      "test_id": "SEC-P09",
      "outcome": "PASS",
      "evidence_path": "evidence/SEC-P09.json",
      "evidence_sha256": "d15f464b2599e7b163a81c688e94c507811eb2ad50143ce8a675e692ef10f35d",
      "commit_sha": "fdc7a5e83c67654e5f72976600873e0f825f172f",
      "image_fingerprint": "sha256:da93c3cea15ac9a19345e82da1fa03eb7089c1de4cd7c7e62d3d70d8cf3e9168 (api=sha256:7289f6d9dc7496c97578bd512ddc72b318c994743c902bea3c5876e978529af4;authority=sha256:7a860ac7d6f9dd4c54c137a94d18eb26e57287c8e09524cbeafb54c50841c360)",
      "executed_at_utc": "2026-10-19T18:17:18Z",
      "authority_revision": 5,
      "content_revision": 1
    },
    {
      "test_id": "SEC-P10",
      "outcome": "PASS",
      "evidence_path": "evidence/SEC-P10.json",
      "evidence_sha256": "fdba1a40d9f3131246f89579fb0d878dd4949a1bdc8c61cda2212e934f575888",
      "commit_sha": "fdc7a5e83c67654e5f72976600873e0f825f172f",
      "image_fingerprint": "sha256:da93c3cea15ac9a19345e82da1fa03eb7089c1de4cd7c7e62d3d70d8cf3e9168 (api=sha256:7289f6d9dc7496c97578bd512ddc72b318c994743c902bea3c5876e978529af4;authority=sha256:7a860ac7d6f9dd4c54c137a94d18eb26e57287c8e09524cbeafb54c50841c360)",
      "executed_at_utc": "2026-10-19T18:16:26Z",
      "authority_revision": 5,
      "content_revision": 2
    },
    {
      "test_id": "SEC-P11",
      "outcome": "PASS",
      "evidence_path": "evidence/SEC-P11.json",
      "evidence_sha256": "4e8a47474fcdc4c4ce4547072bf4288dcb5654b83af6dcbd826c9131a369c570",
      "commit_sha": "fdc7a5e83c67654e5f72976600873e0f825f172f",
      "image_fingerprint": "sha256:da93c3cea15ac9a19345e82da1fa03eb7089c1de4cd7c7e62d3d70d8cf3e9168 (api=sha256:7289f6d9dc7496c97578bd512ddc72b318c994743c902bea3c5876e978529af4;authority=sha256:7a860ac7d6f9dd4c54c137a94d18eb26e57287c8e09524cbeafb54c50841c360)",
      "executed_at_utc": "2026-10-19T18:16:10Z",
      "authority_revision": 3,
      "content_revision": 1
    },
    {
      "test_id": "SEC-P12",
      "outcome": "PASS",
      "evidence_path": "evidence/SEC-P12.json",
      "evidence_sha256": "f5d2677cbe41dd89402505a1f567f446b749e84b2a32a48d7ca38f858d609216",
      "commit_sha": "fdc7a5e83c67654e5f72976600873e0f825f172f",
      "image_fingerprint": "sha256:da93c3cea15ac9a19345e82da1fa03eb7089c1de4cd7c7e62d3d70d8cf3e9168 (api=sha256:7289f6d9dc7496c97578bd512ddc72b318c994743c902bea3c5876e978529af4;authority=sha256:7a860ac7d6f9dd4c54c137a94d18eb26e57287c8e09524cbeafb54c50841c360)",
      "executed_at_utc": "2026-10-19T18:16:45Z",
      "authority_revision": 4,
      "content_revision": 2
    }
  ]
}